{
  "$id": "https://local.invalid/schemas/audience-clips.v1/ResearchBrief.schema.json",
  "title": "ResearchBrief (audience-clips.v1)",
  "$schema": "https://json-schema.org/draft/2020-12/schema",
  "type": "object",
  "properties": {
    "schemaVersion": {
      "type": "string",
      "const": "audience-clips.v1"
    },
    "runId": {
      "type": "string",
      "minLength": 1
    },
    "mode": {
      "type": "string",
      "enum": [
        "live",
        "fixture"
      ]
    },
    "video": {
      "type": "object",
      "properties": {
        "url": {
          "type": "string",
          "format": "uri"
        },
        "videoId": {
          "type": "string",
          "minLength": 1
        },
        "channelId": {
          "type": "string",
          "minLength": 1
        },
        "title": {
          "type": "string"
        }
      },
      "required": [
        "url",
        "videoId",
        "channelId",
        "title"
      ],
      "additionalProperties": false
    },
    "creatorGoal": {
      "type": [
        "string",
        "null"
      ]
    },
    "researchStatus": {
      "type": "string",
      "enum": [
        "ready",
        "insufficient_evidence"
      ]
    },
    "coverage": {
      "type": "object",
      "properties": {
        "fetchedAt": {
          "type": "string",
          "pattern": "^\\d{4}-\\d{2}-\\d{2}T\\d{2}:\\d{2}:\\d{2}(\\.\\d{1,3})?Z$"
        },
        "videoIds": {
          "type": "array",
          "items": {
            "type": "string",
            "minLength": 1
          }
        },
        "commentCount": {
          "type": "integer",
          "minimum": 0,
          "maximum": 9007199254740991
        },
        "samplingMethod": {
          "type": "string",
          "minLength": 1
        },
        "limitations": {
          "type": "array",
          "items": {
            "type": "string"
          }
        }
      },
      "required": [
        "fetchedAt",
        "videoIds",
        "commentCount",
        "samplingMethod",
        "limitations"
      ],
      "additionalProperties": false
    },
    "evidence": {
      "type": "array",
      "items": {
        "type": "object",
        "properties": {
          "id": {
            "type": "string",
            "minLength": 1
          },
          "commentId": {
            "type": "string",
            "minLength": 1
          },
          "videoId": {
            "type": "string",
            "minLength": 1
          },
          "url": {
            "type": "string",
            "format": "uri"
          },
          "quote": {
            "type": "string",
            "minLength": 1
          },
          "publishedAt": {
            "type": "string",
            "pattern": "^\\d{4}-\\d{2}-\\d{2}T\\d{2}:\\d{2}:\\d{2}(\\.\\d{1,3})?Z$"
          }
        },
        "required": [
          "id",
          "commentId",
          "videoId",
          "url",
          "quote",
          "publishedAt"
        ],
        "additionalProperties": false
      }
    },
    "questions": {
      "maxItems": 3,
      "type": "array",
      "items": {
        "type": "object",
        "properties": {
          "id": {
            "type": "string",
            "minLength": 1
          },
          "question": {
            "type": "string",
            "minLength": 1
          },
          "kind": {
            "type": "string",
            "enum": [
              "explicit",
              "inferred"
            ]
          },
          "evidenceIds": {
            "minItems": 1,
            "type": "array",
            "items": {
              "type": "string",
              "minLength": 1
            }
          },
          "observedCommentCount": {
            "type": "integer",
            "exclusiveMinimum": 0,
            "maximum": 9007199254740991
          },
          "priority": {
            "type": "integer",
            "exclusiveMinimum": 0,
            "maximum": 9007199254740991
          },
          "rationale": {
            "type": "string",
            "minLength": 1
          }
        },
        "required": [
          "id",
          "question",
          "kind",
          "evidenceIds",
          "observedCommentCount",
          "priority",
          "rationale"
        ],
        "additionalProperties": false
      }
    },
    "generationBrief": {
      "anyOf": [
        {
          "type": "object",
          "properties": {
            "targetQuestionIds": {
              "minItems": 1,
              "type": "array",
              "items": {
                "type": "string",
                "minLength": 1
              }
            },
            "customPrompt": {
              "type": "string",
              "minLength": 1
            },
            "durationSec": {
              "type": "array",
              "prefixItems": [
                {
                  "type": "integer",
                  "minimum": 0,
                  "maximum": 9007199254740991
                },
                {
                  "type": "integer",
                  "exclusiveMinimum": 0,
                  "maximum": 9007199254740991
                }
              ],
              "items": false,
              "minItems": 2,
              "maxItems": 2
            },
            "aspectRatio": {
              "type": "string",
              "enum": [
                "portrait",
                "landscape",
                "square"
              ]
            }
          },
          "required": [
            "targetQuestionIds",
            "customPrompt",
            "durationSec",
            "aspectRatio"
          ],
          "additionalProperties": false
        },
        {
          "type": "null"
        }
      ]
    }
  },
  "required": [
    "schemaVersion",
    "runId",
    "mode",
    "video",
    "creatorGoal",
    "researchStatus",
    "coverage",
    "evidence",
    "questions",
    "generationBrief"
  ],
  "additionalProperties": false
}
